{"schemaVersion":2,"contract":"risk-preview","requestId":"request-synthetic","asOf":"2026-10-14T08:00:00+00:00","data":{"previewId":"preview-synthetic","plan":{"walletId":"wallet-synthetic","instrumentId":"instrument-synthetic","direction":"long","entryPrice":"50000","stopPrice":"49000","sizingKind":"riskAmount","sizingValue":"100","targets":[{"ordinal":1,"price":"52000","exitFraction":"1"}]},"instrumentSpecVersionId":"spec-synthetic-v1","baselineAssetId":"asset-usdt-synthetic","balanceBasisReceiptId":"basis-synthetic","projection":{"schemaVersion":2,"contract":"setup-risk","walletId":"wallet-synthetic","instrumentId":"instrument-synthetic","instrumentSpecVersionId":"spec-synthetic-v1","baselineAsset":"asset-usdt-synthetic","policy":"initial-price-risk-v2","chosenSizingValue":"100","riskBudgetAmount":"100","quantity":"0.1","initialRiskAmount":"100","positionValue":"5000","balanceAtPlan":"10000","riskPercentOfBalance":"1","weightedPlannedR":"2","targets":[{"ordinal":1,"price":"52000","r":"2","exitFraction":"1"}],"incompleteReasons":[]},"canonicalInputHash":"aaaaaaaaaaaaaaaaaaaaaaaaaaaaaaaaaaaaaaaaaaaaaaaaaaaaaaaaaaaaaaaa","policy":"initial-price-risk-v2","decisionAtUtc":"2026-10-14T08:00:00+00:00","computedAtUtc":"2026-10-14T08:00:00+00:00","expiresAtUtc":"2026-10-14T08:15:00+00:00","publicationSequence":3}}
